{"$defs":{"authority_boundary":{"additionalProperties":false,"properties":{"classification":{"const":"derived_non_authoritative"},"denied_authorities":{"const":["product_sha","control_sha","context_sha","authoritative_project_state","github_issue_lifecycle","task_ownership","task_readiness","dependency_completion","ci_status","branch_protection_ruleset_state","source_freshness","provenance_acceptance","deterministic_coverage_acceptance","requirement_completion","merge_authority"]},"may_override":{"maxItems":0,"type":"array"}},"required":["classification","may_override","denied_authorities"],"type":"object"},"public_data":{"additionalProperties":false,"properties":{"classification":{"const":"public-disclosure-safe"},"forbidden_categories":{"const":["api_secrets_tokens","cookies","browser_profiles","account_credentials","private_keys","session_state","personal_data","sensitive_raw_evidence","secret_bearing_environment_or_config"]},"on_violation":{"const":"reject"},"policy":{"const":"hwm-public-data/v1"}},"required":["policy","classification","forbidden_categories","on_violation"],"type":"object"}},"$id":"urn:hwm:schema:semantic-coverage:v1","$schema":"https://json-schema.org/draft/2020-12/schema","additionalProperties":false,"properties":{"authority_boundary":{"$ref":"#/$defs/authority_boundary"},"batch_id":{"pattern":"^smb1-[0-9a-f]{64}$","type":"string"},"classification":{"const":"derived_non_authoritative"},"coverage_id":{"pattern":"^scv1-[0-9a-f]{64}$","type":"string"},"coverage_sha256":{"pattern":"^[0-9a-f]{64}$","type":"string"},"manifest_sha256":{"pattern":"^[0-9a-f]{64}$","type":"string"},"public_data":{"$ref":"#/$defs/public_data"},"rows":{"items":{"additionalProperties":false,"allOf":[{"if":{"properties":{"status":{"const":"processed"}},"required":["status"]},"then":{"properties":{"reason":{"type":"null"}}}},{"if":{"properties":{"status":{"enum":["deferred","unsupported","duplicate","rejected"]}},"required":["status"]},"then":{"properties":{"reason":{"type":"object"}}}}],"properties":{"reason":{"oneOf":[{"type":"null"},{"additionalProperties":false,"properties":{"code":{"enum":["deferred_to_later_batch","unsupported_source","duplicate_source","policy_rejected","validation_failed","partition_required"]},"detail":{"maxLength":1000,"minLength":1,"type":"string"}},"required":["code","detail"],"type":"object"}]},"source_id":{"pattern":"^src1-[0-9a-f]{64}$","type":"string"},"status":{"enum":["processed","deferred","unsupported","duplicate","rejected"]}},"required":["source_id","status","reason"],"type":"object"},"minItems":1,"type":"array"},"schema":{"const":"hwm-semantic-coverage/v1"}},"required":["schema","batch_id","manifest_sha256","coverage_id","coverage_sha256","classification","rows","authority_boundary","public_data"],"title":"HWM semantic coverage v1","type":"object"}
