{"authority_boundary":{"classification":"derived_non_authoritative","denied_authorities":["product_sha","control_sha","context_sha","authoritative_project_state","github_issue_lifecycle","task_ownership","task_readiness","dependency_completion","ci_status","branch_protection_ruleset_state","source_freshness","provenance_acceptance","deterministic_coverage_acceptance","requirement_completion","merge_authority"],"may_override":[]},"batch_id":"smb1-6bbf7987de53b0922795a707dfe07e86b6b4c86b6d6ed0393e87fe27cf8f5ecc","classification":"derived_non_authoritative","coverage_id":"scv1-d7933da80707fa78ed9f60d4861db286a416d995d3fcd896c234fb3244a1fdca","coverage_sha256":"d7933da80707fa78ed9f60d4861db286a416d995d3fcd896c234fb3244a1fdca","manifest_sha256":"6bbf7987de53b0922795a707dfe07e86b6b4c86b6d6ed0393e87fe27cf8f5ecc","public_data":{"classification":"public-disclosure-safe","forbidden_categories":["api_secrets_tokens","cookies","browser_profiles","account_credentials","private_keys","session_state","personal_data","sensitive_raw_evidence","secret_bearing_environment_or_config"],"on_violation":"reject","policy":"hwm-public-data/v1"},"rows":[{"reason":null,"source_id":"src1-0fa22155b102f83697b835c2b399bcefb3fd163b5332d255f9f33e592432d53c","status":"processed"},{"reason":null,"source_id":"src1-107ec3fe2c559d07d128667fc982f772720d36be6f59685613dc7733676e625a","status":"processed"},{"reason":null,"source_id":"src1-1513eacf3522c7cd8996d9829ce5f9609e701aa96aac19aa9d9f8753be293e2d","status":"processed"},{"reason":null,"source_id":"src1-1a68af9dbabc92a452371c37a47407f469c8915ceb0698ea76b8ec02a82f5b9b","status":"processed"},{"reason":null,"source_id":"src1-45110d2c80ba12c187ccf31b87c8b5c2702983060019fc0a85156abf39581e3e","status":"processed"},{"reason":null,"source_id":"src1-53b1a8ab153d4d2fafc0c6e5ed315bd440e73eae0dbe39c34c8c6e4103359a26","status":"processed"},{"reason":null,"source_id":"src1-644ca4ebf6c53d046548e1b7b4fe3153c3bd7b945d0049aafa0b173e83a058ca","status":"processed"},{"reason":null,"source_id":"src1-6cc3118e1e0936f0a7718e689f394cf31f04e8e62ec2428c73c5fc9d1875367d","status":"processed"},{"reason":null,"source_id":"src1-86ed67ee4c0bc0faf2f97f55e09d5f5cd92a571024ca8d7a9cb9c31244ca0b90","status":"processed"},{"reason":null,"source_id":"src1-8859b0ea2062e3a883b009ed120dc9415a902590d35f93dfe102459a8cfa4749","status":"processed"},{"reason":null,"source_id":"src1-966412956ab7370cb2656b0197bda6526c0dfe0ccd0b63949cb6fe993f9ee7c4","status":"processed"},{"reason":null,"source_id":"src1-9de7fe1c8ec5736b785ae6e92a790f9dd4821b52bdc3b600fc7b8b9d9944fb29","status":"processed"},{"reason":null,"source_id":"src1-a49b40e363399c2ca7e58ae97496026983838cad8ae8d6b687dd412c94a0429e","status":"processed"},{"reason":null,"source_id":"src1-a5ab013bdcaa707a6b8c65f20ab84b92c128f25f774bf1cc8f09c6cde918148a","status":"processed"},{"reason":null,"source_id":"src1-b7458b3c6cb63f58649d2fec4dce2d4e9dc16f1b26a7a8f3be8f76d4dff8f65e","status":"processed"},{"reason":null,"source_id":"src1-c9759ec0d8276aae1e7886861650f7c81f1d597eb3b7fa888483de4fa3e7647a","status":"processed"},{"reason":null,"source_id":"src1-dd5dc484443578d3b98dccc592c7a31f5094533bd9d1531f3e71e4d34f5f11b2","status":"processed"},{"reason":null,"source_id":"src1-df1dea1806ee611269d150e5d1886b6bdc1c6676f9002f411e9d29e492d2d898","status":"processed"},{"reason":null,"source_id":"src1-edfdd512648f3ff3742f066cff9f0a15d4cb59aeab191a09b61c0042c51cdb5e","status":"processed"}],"schema":"hwm-semantic-coverage/v1"}